{
  "schema_version": 1,
  "contract_id": "thailand-real-estate-v1",
  "site": {
    "origin": "https://thai-land.co.il",
    "locale": "he-IL",
    "direction": "rtl"
  },
  "hub_route_id": "thailand-real-estate",
  "body_contract": {
    "mode": "preserve_wordpress_body",
    "mutation_allowed": false,
    "source_field": "post_content",
    "wordpress_filter": "the_content",
    "public_punctuation_policy": "replace_long_dashes_with_hyphen",
    "prefix_components": [
      "breadcrumb",
      "route_intro"
    ],
    "suffix_components": [
      "continuations",
      "freshness",
      "sources"
    ]
  },
  "rendering_owners": {
    "h1": "content_template",
    "metadata": "yoast_filters",
    "breadcrumb": "content_template_once",
    "schema": "none_in_v1"
  },
  "public_labels": {
    "breadcrumbs_aria": "פירורי לחם",
    "hub_return": "לכל מדריכי הנדל״ן בתאילנד",
    "continuations_heading": "עוד מדריכים בנושא",
    "freshness_heading": "פרטים שמשתנים",
    "sources_heading": "מקורות שימושיים",
    "card_action": "למדריך המלא"
  },
  "freshness_catalog": [
    {
      "freshness_id": "market-monthly",
      "label": "מחירים ומימון",
      "detail": "ריבית, שערי מטבע, עמלות ומחירי שוק משתנים לאורך הזמן"
    },
    {
      "freshness_id": "rules-monthly",
      "label": "בעלות ורישום",
      "detail": "חוקים, נהלים, מסמכים ואגרות יכולים להשתנות"
    },
    {
      "freshness_id": "service-quarterly",
      "label": "ניהול ושכירות",
      "detail": "זמינות שירותים, דמי ניהול, תחזוקה ועלויות תפעול משתנים"
    }
  ],
  "source_catalog": [
    {
      "source_id": "bank-of-thailand",
      "label": "הבנק המרכזי של תאילנד",
      "url": "https://www.bot.or.th/en/home.html",
      "scope_label": "ריבית, אשראי, מטבע ונתוני שוק"
    },
    {
      "source_id": "bangkok-metropolitan-administration",
      "label": "עיריית בנגקוק",
      "url": "https://main.bangkok.go.th/",
      "scope_label": "שירותים עירוניים ומידע מקומי בבנגקוק"
    },
    {
      "source_id": "consumer-protection-board",
      "label": "המשרד להגנת הצרכן בתאילנד",
      "url": "https://www.ocpb.go.th/",
      "scope_label": "זכויות צרכניות, חוזים ופניות ציבור"
    },
    {
      "source_id": "royal-gazette",
      "label": "הרשומות הרשמיות של תאילנד",
      "url": "https://ratchakitcha.soc.go.th/",
      "scope_label": "חוקים, תקנות והודעות רשמיות"
    },
    {
      "source_id": "thai-land-department",
      "label": "מחלקת הקרקעות של תאילנד",
      "url": "https://www.dol.go.th/",
      "scope_label": "רישום מקרקעין, בתים משותפים והעברת זכויות"
    },
    {
      "source_id": "thai-revenue-department",
      "label": "רשות המסים של תאילנד",
      "url": "https://www.rd.go.th/english/",
      "scope_label": "מסים, אגרות וחובות דיווח"
    }
  ],
  "routes": [
    {
      "route_id": "thailand-real-estate",
      "kind": "hub",
      "path": "/נדלן-בתאילנד/",
      "parent_route_id": null,
      "wordpress": {
        "post_id": 841,
        "post_type": "page",
        "identity_policy": "id_and_path_exact",
        "body_mode": "preserve"
      },
      "ownership": {
        "primary_keyword": "נדל״ן בתאילנד",
        "synonyms": [
          "נכסים בתאילנד",
          "שוק הנדל״ן בתאילנד",
          "Thailand real estate"
        ],
        "intent": "לקבל תמונה מלאה ולבחור מסלול מתאים לקנייה, שכירות, מימון או ניהול נכס בתאילנד"
      },
      "public": {
        "h1": "נדל״ן בתאילנד: קנייה, שכירות, מחירים וניהול נכסים",
        "seo_title": "נדל״ן בתאילנד: מדריך לקנייה, שכירות והשקעה",
        "meta_description": "נדל״ן בתאילנד במקום אחד: תהליך קנייה, כללי בעלות לזרים, מחירים, מימון, שכירות בבנגקוק וניהול נכסים, עם מסלול ברור לכל צורך.",
        "summary": "מתחילים מהמטרה שלכם ומתקדמים אל המדריך המדויק, מהיכרות עם השוק ועד חוזה, מימון, רישום וניהול שוטף."
      },
      "breadcrumbs": [
        {
          "label": "ראשי",
          "path": "/",
          "route_id": null
        },
        {
          "label": "נדל״ן בתאילנד",
          "path": "/נדלן-בתאילנד/",
          "route_id": "thailand-real-estate"
        }
      ],
      "parent_link": null,
      "continuations": [
        {
          "target_route_id": "thailand-property-financing",
          "label": "משכנתא ומימון נכס בתאילנד",
          "context": "בדקו אילו מסלולי מימון עשויים להתאים וכיצד לחשב הון עצמי ועלויות אשראי."
        },
        {
          "target_route_id": "thailand-property-buying-mistakes",
          "label": "טעויות נפוצות בקניית נכס",
          "context": "עברו על הבדיקות שכדאי להשלים לפני מקדמה, חתימה והעברת זכויות."
        },
        {
          "target_route_id": "bangkok-apartment-rental",
          "label": "השכרת דירה בבנגקוק",
          "context": "השוו שכונות, תנאי חוזה והוצאות שוטפות לפני בחירת דירה בבנגקוק."
        },
        {
          "target_route_id": "buy-property-thailand",
          "label": "קניית נכס בתאילנד",
          "context": "הכירו את שלבי הקנייה מהגדרת התקציב ועד רישום הזכויות וקבלת הנכס."
        },
        {
          "target_route_id": "foreign-condo-ownership-thailand",
          "label": "בעלות זרים על דירה בתאילנד",
          "context": "הבינו כיצד פועלת בעלות בבית משותף ואילו מסמכים חשוב לבדוק."
        },
        {
          "target_route_id": "thailand-property-management",
          "label": "ניהול נכסים בתאילנד",
          "context": "תכננו טיפול בשוכרים, תחזוקה, גבייה ודיווח כאשר הנכס כבר בבעלותכם."
        },
        {
          "target_route_id": "thailand-property-prices",
          "label": "מחירי נדל״ן בתאילנד",
          "context": "בנו מסגרת תקציב לפי סוג נכס והוסיפו את עלויות העסקה וההחזקה."
        }
      ],
      "freshness_id": "market-monthly",
      "source_ids": [
        "bank-of-thailand",
        "royal-gazette",
        "thai-land-department",
        "thai-revenue-department"
      ]
    },
    {
      "route_id": "thailand-property-financing",
      "kind": "spoke",
      "path": "/אפשרויות-משכנתא-ומימון-נכסים-בתאילנד/",
      "parent_route_id": "thailand-real-estate",
      "wordpress": {
        "post_id": 65,
        "post_type": "post",
        "identity_policy": "id_and_path_exact",
        "body_mode": "preserve"
      },
      "ownership": {
        "primary_keyword": "משכנתא בתאילנד לזרים",
        "synonyms": [
          "מימון נכס בתאילנד לזרים",
          "הלוואה לקניית דירה בתאילנד",
          "property finance Thailand"
        ],
        "intent": "להבין אפשרויות מימון, דרישות הון עצמי ועלויות אשראי לפני רכישת נכס בתאילנד"
      },
      "public": {
        "h1": "משכנתא בתאילנד לזרים: מימון לקניית נכס",
        "seo_title": "משכנתא בתאילנד לזרים: מסלולי מימון ועלויות",
        "meta_description": "משכנתא בתאילנד לזרים: הכירו מסלולי מימון אפשריים, דרישות הון עצמי, מסמכים, עלויות אשראי וחלופות לתכנון רכישת נכס.",
        "summary": "מפת אפשרויות למימון העסקה, עם השאלות שצריך לשאול על זכאות, בטוחות, מטבע, ריבית והחזר חודשי."
      },
      "breadcrumbs": [
        {
          "label": "ראשי",
          "path": "/",
          "route_id": null
        },
        {
          "label": "נדל״ן בתאילנד",
          "path": "/נדלן-בתאילנד/",
          "route_id": "thailand-real-estate"
        },
        {
          "label": "משכנתא ומימון",
          "path": "/אפשרויות-משכנתא-ומימון-נכסים-בתאילנד/",
          "route_id": "thailand-property-financing"
        }
      ],
      "parent_link": {
        "target_route_id": "thailand-real-estate",
        "label": "לכל מדריכי הנדל״ן בתאילנד",
        "context": "חזרו למפת הדרכים המלאה כדי לחבר בין מימון, בחירת נכס, זכויות ועלויות עסקה."
      },
      "continuations": [
        {
          "target_route_id": "buy-property-thailand",
          "label": "תהליך קניית נכס בתאילנד",
          "context": "חברו את בחירת המימון לשלבי הקנייה, הבדיקות, החוזה ורישום הזכויות."
        },
        {
          "target_route_id": "thailand-property-prices",
          "label": "מחירי נכסים ועלויות עסקה",
          "context": "העריכו את מחיר הנכס ואת ההוצאות הנלוות לפני קביעת סכום המימון."
        }
      ],
      "freshness_id": "market-monthly",
      "source_ids": [
        "bank-of-thailand",
        "thai-land-department",
        "thai-revenue-department"
      ]
    },
    {
      "route_id": "thailand-property-buying-mistakes",
      "kind": "spoke",
      "path": "/5-הטעויות-המובילות-שיש-להימנע-מהן-בעת/",
      "parent_route_id": "thailand-real-estate",
      "wordpress": {
        "post_id": 69,
        "post_type": "post",
        "identity_policy": "id_and_path_exact",
        "body_mode": "preserve"
      },
      "ownership": {
        "primary_keyword": "טעויות בקניית נכס בתאילנד",
        "synonyms": [
          "בדיקת נאותות לנכס בתאילנד",
          "סיכונים ברכישת נכס בתאילנד",
          "Thailand property due diligence"
        ],
        "intent": "לזהות סיכונים ולבצע בדיקות לפני מקדמה, חוזה, העברת כסף ורישום נכס בתאילנד"
      },
      "public": {
        "h1": "טעויות בקניית נכס בתאילנד: 5 בדיקות לפני חתימה",
        "seo_title": "טעויות בקניית נכס בתאילנד: מה לבדוק לפני חוזה",
        "meta_description": "טעויות בקניית נכס בתאילנד עלולות להתחיל עוד לפני החוזה. הנה הבדיקות החשובות לבעלות, מסמכים, תשלומים, מסירה ורישום הזכויות.",
        "summary": "רשימת בדיקות ממוקדת שמסדרת את נקודות הסיכון לפני שמתחייבים לעסקה או מעבירים כסף."
      },
      "breadcrumbs": [
        {
          "label": "ראשי",
          "path": "/",
          "route_id": null
        },
        {
          "label": "נדל״ן בתאילנד",
          "path": "/נדלן-בתאילנד/",
          "route_id": "thailand-real-estate"
        },
        {
          "label": "טעויות בקניית נכס",
          "path": "/5-הטעויות-המובילות-שיש-להימנע-מהן-בעת/",
          "route_id": "thailand-property-buying-mistakes"
        }
      ],
      "parent_link": {
        "target_route_id": "thailand-real-estate",
        "label": "לכל מדריכי הנדל״ן בתאילנד",
        "context": "חזרו למפת הדרכים המלאה כדי לראות כיצד הבדיקות משתלבות בבחירת נכס, מימון וניהול."
      },
      "continuations": [
        {